{
  "$schema": "https://json-schema.org/draft/2020-12/schema",
  "title": "ContentItem",
  "type": "object",
  "required": ["id", "title"],
  "properties": {
    "id":            { "type": "string", "minLength": 3 },
    "title":         { "type": "string", "minLength": 2 },
    "contentEn":     { "type": "string" },
    "contentSw":     { "type": "string" },
    "tags":          { "type": "array", "items": { "type": "string" } },
    "image":         { "type": "string" },
    "imageMeta":     { "type": "object" },
    "category":      { "type": "string" },        
    "source":        { "type": "string" },        
    "needsReview":   { "type": "boolean" },       
    "missingFields": { "type": "array", "items": { "type": "string" } } 
  },
  "additionalProperties": true
}
