[
  {
    "id": "disease-urinary-kidney-problems",
    "title": "Kidney Problems",
    "contentEn": "TREATMENT\n• Eat 75% raw foods, including garlic, parsley, potatoes, celery, cucumbers, and bananas.\nGreen vegetables are especially important.\n• Stop eating meat. An excess of protein is part of your problem; and meat also has a\nvariety of waste products, plus bacteria, purines, and uric acid.\n• Avoid dairy products, except yogurt. Do not eat chocolate or cocoa.\n• Drink 6-8 ounces of distilled water every hour.\n• Watermelon and pumpkin seeds seem to help the kidneys, although the reason is not\nknown.\n• Corn-silk tea is the best single herb for increasing urine flow and restoring the kidneys.\nWatermelon-seed tea and celery and parsley seeds are also diuretic in function.\n• Cranberries help acidify the urine, destroy bacteria, and restore the bladder.\n• Do not eat much potassium or phosphorous. For this reason, avoid beet greens, spinach,\nrhubarb, and Swiss chard.\n• Lead, other metals, the pain relieving drugs (Advil, Nuprin, etc.), and infectious diseases\n(scarlet fever, measles, etc.) can damage the kidneys. Spirulina is known to reduce kidney\npoisoning that is caused by mercury and drugs.\nPROBLEMS AND CAUSES—In addition to other conditions mentioned in this section on the kidneys,\nthere are less known diseases which can be just as serious. These include:\nRenal tubular acidosis: The kidneys fail to reabsorb bicarbonate properly, resulting in inadequate\nammonia production and acid excretion. This leads to a severe lack of fluid and potassium in the body,\nand an excess of acidity. The bones can become deranged.\nHydronephrosis: The kidneys and bladder become filled with urine, due to obstruction of the flow.\nGlomerulonephritis: This is an inflammation of the tiny kidney filtering units, sometimes resulting from\na bacterial infection in the body.\nUremia: A toxic waste buildup in the blood, due to kidney malfunction.\nIn all of these conditions, a basic need is to cleanse the kidneys, increase urine flow, and restore proper\nfunction.",
    "contentSw": "Matibabu\n• Kula vyakula mbichi 75%, pamoja na vitunguu, parsley, viazi, celery, matango, na ndizi.\nMboga ya kijani ni muhimu sana.\n• Acha kula nyama. Kuzidi kwa protini ni sehemu ya shida yako; na nyama pia ina\nAina ya bidhaa za taka, pamoja na bakteria, purines, na asidi ya uric.\n• Epuka bidhaa za maziwa, isipokuwa mtindi. Usila chokoleti au kakao.\n• Kunywa ounces 6-8 za maji yaliyosafishwa kila saa.\n• Mbegu za tikiti na malenge zinaonekana kusaidia figo, ingawa sababu sio\ninayojulikana.\n• Chai ya kumwagika kwa mahindi ni mimea bora moja kwa kuongeza mtiririko wa mkojo na kurejesha figo.\nChai ya mbegu za mbegu na mbegu za celery na mbegu za parsley pia zinafanya kazi.\n• Cranberries husaidia asidi ya mkojo, kuharibu bakteria, na kurejesha kibofu cha mkojo.\n• Usila potasiamu nyingi au fosforasi. Kwa sababu hii, epuka mboga za beet, mchicha,\nRhubarb, na Uswisi Chard.\n• Kuongoza, metali zingine, dawa za kupunguza maumivu (Advil, Nuprin, nk), na magonjwa ya kuambukiza\n(Homa ya Scarlet, surua, nk) inaweza kuharibu figo. Spirulina inajulikana kupunguza figo\nsumu ambayo husababishwa na zebaki na dawa za kulevya.\nShida na sababu -kwa kuongeza hali zingine zilizotajwa katika sehemu hii kwenye figo,\nKuna magonjwa yasiyojulikana ambayo yanaweza kuwa mazito tu. Hii ni pamoja na:\nAcidosis ya Tubular Acidosis: figo hushindwa kurudisha bicarbonate vizuri, na kusababisha kutotosha\nUzalishaji wa Amonia na excretion ya asidi. Hii husababisha ukosefu mkubwa wa maji na potasiamu mwilini,\nna ziada ya acidity. Mifupa inaweza kupunguka.\nHydronephrosis: figo na kibofu cha mkojo hujazwa na mkojo, kwa sababu ya kizuizi cha mtiririko.\nGlomerulonephritis: Huu ni uchochezi wa vitengo vidogo vya kuchuja vya figo, wakati mwingine hutokana na\nmaambukizi ya bakteria mwilini.\nUremia: Kujengwa kwa taka zenye sumu kwenye damu, kwa sababu ya utendakazi wa figo.\nKatika hali hizi zote, hitaji la msingi ni kusafisha figo, kuongeza mtiririko wa mkojo, na kurejesha sahihi\nkazi."
  },
  {
    "id": "disease-urinary-renal-colic",
    "title": "Renal Colic",
    "contentEn": "TREATMENT\n• Drink plenty of pure water. Avoid coffee, alcohol, and artificial drinks.\n• Drinking unsweetened cranberry juice and apple juice helps reduce bacterial growth in\nthe kidneys.\n• Carrot, celery, and parsley juice is also helpful.\n• Eat nourishing food, and avoid processed and junk food.\n• Include enough vitamins C, A, and B complex in the diet. Potassium deficiencies can\nencourage kidney problems.\n• Go on a 3-day cleansing water-and-juice fast. Take enemas and rest. Keep the fluid level\nhigh.\n• Helpful herbs include garlic, echinacea, burdock, red clover, and goldenseal. Also of\nvalue: juniper berries, parsley, and watermelon-seed tea. Buchu tea and marshmallow tea\nare most helpful.\n• Used in conjunction with more fluid intake, corn-silk tea has been used for hundreds of\nyears to increase urine output, a very necessary factor in purifying and detoxifying the\nkidneys.\n- Also see \"Cystitis\" (infection of the bladder). The two are closely associated in health\nand in sickness. Also see \"Bright's Disease,\" which is a variant form of nephritis.\n—Also see \"Nephritis—2.\"\n(Kidney Pain Attack) (J.H. Kellogg, M.D., Formulas)\nDURING ATTACK—Rest in bed; diet of fruit; buttermilk; hot water drinking; Hot Enema, repeat\nevery 2 hours; Hot Full Bath with cold to head and over heart, if bath is greatly prolonged; Hot Trunk\nPack renewed hourly; Revulsive Sitz Bath; Cold Compress over heart, if it is weak or much excited.\nTO PREVENT ATTACKS—Combat lithemia.\nVOMITING—Ice pills, ice to throat.\nURINARY SUPPRESSION—Hot Blanket Pack followed by Dry sweating Pack.\n—Also see \"Kidney Stones—1 and Kidney Stones—2.\"\nNEPHRITIS—1\n(Kidney Infection)\nSYMPTOMS—There may be no symptoms or they may include blood and/or albumin in the urine and\nlower back, abdominal pain, even chills, fatigue, edema, nausea and vomiting, frequent urge to urinate,\nand loss of appetite. Severe cases may include anemia and high blood pressure.\nCAUSES—This is inflammation of one or both kidneys. Thousands of tiny cells in the kidneys filter\nfluids out of the blood in order to purify it. But the filter can become plugged with toxins and mucous.\nWhen these tiny cells become swollen and inflamed, infection soon follows.\nThis infection can be acute or chronic, and may require hospitalization.\nConstipation causes a toxic matter to be reabsorbed by the blood. This clogs the kidneys.\nOveruse of aspirin and other pain killers weaken the kidneys; beer can cause their failure. Environmental\ntoxins, such as heavy metals, add to the damage. Anti-hypertensive drugs are used to reduce blood\ncirculation, and therefore injure the kidneys.\nKidney infection can also be caused by bacterial infection in the bladder (cystitis, which see) which has\ntraveled up the ureters to the kidneys.",